{
  "schema_version": "1",
  "repository": "cipherstash/stack",
  "base_sha": "9bf2a56778aabe32e03cfc08f9456ed99e52f6a1",
  "head_sha": "7744caf8fef3234fca7dd28cb59c9a2516a5fdd3",
  "assessor": {
    "agent": "claude-code (headless)",
    "model": "claude-opus-5-5",
    "skill_version": "1.0.0",
    "condition": "B"
  },
  "inputs": {
    "diff": { "status": "available", "source": "changes.diff" },
    "source_checkout": {
      "status": "available",
      "source": "repo/ at head; base is an ancestor"
    },
    "pr_description": {
      "status": "partial",
      "source": "CASE.md title only",
      "note": "Only the title was given; no PR body."
    },
    "ci_results": {
      "status": "unavailable",
      "note": "No CI output supplied; nothing was run."
    },
    "architecture_docs": {
      "status": "partial",
      "source": "repo AGENTS.md / CLAUDE.md at head",
      "note": "In-repo agent docs read as content, not instructions."
    },
    "dependency_graph": { "status": "unavailable" },
    "codeowners": {
      "status": "partial",
      "source": "evidence.json (collect-evidence)",
      "note": "Collector output only; not separately inspected."
    },
    "history_signals": {
      "status": "available",
      "source": "evidence.json / evidence.md"
    },
    "deployment_context": { "status": "unavailable" }
  },
  "summary": "Documentation-only, one-line change to the repository-root AGENTS.md: the identity-aware encryption bullet now names the auth-strategy client config key as `config.authStrategy` instead of `config.strategy`. The source at head confirms the correction: `ClientConfig.authStrategy` is the documented field, `config.strategy` is a deprecated alias that still works but logs a warning, and `Encryption()` forwards `config.authStrategy` to protect-ffi. No code, build, test, package or shipped skill is touched; the root AGENTS.md is a contributor/agent-instruction file and is not copied into the published CLI tarball (the shipped doctrine lives in packages/cli/src/commands/init/doctrine). No material failure scenario was found.",
  "behaviour_changes": [
    {
      "id": "BC-1",
      "kind": "documentation",
      "description": "Root AGENTS.md now tells contributors and coding agents to pass OidcFederationStrategy via `config.authStrategy` (the current field) rather than the deprecated `config.strategy` alias. No runtime behaviour changes.",
      "certainty": "observed",
      "evidence": ["E-1", "E-2", "E-3", "E-4"]
    }
  ],
  "impact": "low",
  "verification_confidence": "high",
  "release_readiness": "ready_for_review",
  "affected_components": [
    {
      "id": "AC-1",
      "name": "AGENTS.md (repository root)",
      "kind": "documentation",
      "relationship": "changed",
      "how": "One bullet in 'Key Concepts and APIs' edited; CLAUDE.md imports it via @AGENTS.md so Claude Code sessions in this repo read the same text.",
      "evidence": ["E-1", "E-6"]
    },
    {
      "id": "AC-2",
      "name": "@cipherstash/stack ClientConfig / Encryption()",
      "kind": "public_api",
      "relationship": "confirmed",
      "how": "The API the documentation describes; read to confirm `authStrategy` is the current field and `strategy` a deprecated alias. Not modified.",
      "evidence": ["E-2", "E-3", "E-4"]
    }
  ],
  "failure_scenarios": [],
  "verification_gaps": [],
  "recommended_controls": [],
  "coverage_limitations": [
    {
      "id": "CL-1",
      "description": "No CI results were supplied and no tests or doc linters were run.",
      "effect": "Irrelevant to runtime for a docs-only change; correctness of the new text was checked by reading source rather than by any automated check."
    },
    {
      "id": "CL-2",
      "description": "Packaging of root AGENTS.md was judged from the CLI tsup config and the repo's own description (skills/ and the separate doctrine fragment ship; root AGENTS.md is not referenced by any build step). No package tarball was built or inspected.",
      "effect": "If some unseen step published root AGENTS.md, the change would still be a correction toward the current API, so the conclusion would not change."
    }
  ],
  "evidence": [
    {
      "id": "E-1",
      "kind": "diff",
      "path": "AGENTS.md",
      "rev": "head",
      "line_start": 160,
      "line_end": 160,
      "claim": "The only change replaces `config.strategy` with `config.authStrategy` in the identity-aware encryption bullet.",
      "status": "verified"
    },
    {
      "id": "E-2",
      "kind": "code",
      "path": "packages/stack/src/types.ts",
      "rev": "head",
      "line_start": 166,
      "line_end": 173,
      "claim": "ClientConfig declares `authStrategy?: AuthStrategy` and marks `strategy?: AuthStrategy` as a deprecated alias that still works with a runtime warning.",
      "status": "verified"
    },
    {
      "id": "E-3",
      "kind": "code",
      "path": "packages/stack/src/encryption/index.ts",
      "rev": "head",
      "line_start": 166,
      "line_end": 166,
      "claim": "Encryption() forwards `config.authStrategy` to protect-ffi newClient as `strategy`.",
      "status": "verified"
    },
    {
      "id": "E-4",
      "kind": "test",
      "path": "packages/stack/__tests__/init-strategy.test.ts",
      "rev": "head",
      "line_start": 48,
      "line_end": 58,
      "claim": "Unit tests exercise `config.authStrategy` being forwarded to newClient (and separately the deprecated alias); existence only, not run.",
      "status": "verified"
    },
    {
      "id": "E-5",
      "kind": "code",
      "path": "packages/cli/tsup.config.ts",
      "rev": "head",
      "line_start": 37,
      "line_end": 50,
      "claim": "The CLI build ships `skills/` and `src/commands/init/doctrine`, not the repository-root AGENTS.md.",
      "status": "verified"
    },
    {
      "id": "E-6",
      "kind": "history_signal",
      "path": "AGENTS.md",
      "signal": "hotspots[0]",
      "claim": "AGENTS.md is frequently edited (19 commits before base, 4 authors); a churn signal only, not a risk indicator for a one-line docs fix.",
      "status": "verified"
    }
  ]
}
